"H_076.txt","Rex Tillerson","Above right, the new secretary of state,",", at the Washington gathering with King Abdullah II of Jordan.

•he U.S. defense secretary, Jim Mattis, arrives in Japan, his second stop on a trip meant to reassure Asian allies concerned about whether the U.S. would shift its posture in the region.

A day earlier, he met with officials in South Korea, above, who agreed to push ahead with the deployment of a new missile defense system, known by the acronym Thaad, that is designed to intercept North Korea’ medium-range missiles.

_____

•n Myanm"
"H_076.txt","Super Bowl Sunday","Back Story","is approaching, and if you’e gearing up to watch the big game, you’e probably thinking about snacks. Which brings us to the potato chip and its exotic side.

Americans consumed an estimated 11.2 million pounds of chips during last year’ game. Plain old “lain”emains popular, but more daring varieties are available on American supermarket shelves, like dill pickle or crab.

And around the world, there are dozens of fascinating flavors.

In Britain, Walkers Crisps boast flavors like prawn cocktail"
"H_076.txt","Trump White House","The disruptions emanating from the","will dominate a European Union summit meeting in Malta today."
"H_076.txt","Travis Kalanick","•ber’ chief executive,",", told employees he was stepping down from President Trump’ economic advisory council, saying his participation had been mistaken for endorsement.

•ech tip: Here’ how to fend off cyber hijacking of home devices.

•all Street trading was mixed. Here’ a snapshot of global markets.

In the News

•resident Vladimir V. Putin of Russia traveled to Hungary for his first foray into Europe in the Trump era, and a note of triumphalism was in the air. [The New York Times]

•utraged Romanians took to the s"
"H_076.txt","Song Kyung","Stephen Crowley/The New York Times | Pool photo by","-Seok | Aung Shine Oo/Associated Press | Lam Yik Fei for The New York Times | Torsten Silz/European Pressphoto Agency | Sputnik, via Reuters | Stan Honda/Agence France-Presse —etty Images | Illustration/Jian Han, via Reuters | Tony Cenicola/The New York Times

Document NYTFEED020170202ed22006y1"
"H_076.txt","Stephen Crowley","","/The New York Times | Pool photo by Song Kyung-Seok | Aung Shine Oo/Associated Press | Lam Yik Fei for The New York Times | Torsten Silz/European Pressphoto Agency | Sputnik, via Reuters | Stan Honda/Agence France-Presse —etty Images | Illustration/Jian Han, via Reuters | Tony Cenicola/The New York Times

Document NYTFEED020170202ed22006y1"
"H_076.txt","World Chess Champion","•he Women’",", Hou Yifan of China, threw a game after five moves to protest being repeatedly matched with women at a mixed tournament. [The Straits Times]

Smarter Living

•re you one of those people who leave their phone plugged in all night? Good news: It probably isn’ harming your battery.

• woman whose partner died fell into months of despondency. Here’ how she got back on her feet.

•ecipe of the day: End the workweek with some Italian comfort food, pork cutlets parmigiana.

Noteworthy

•ee the resembl"
"H_076.txt","Michael Barbaro","Our reporter","runs down the big stories and the big ideas."
"H_076.txt","South Korea","A day earlier, he met with officials in",", above, who agreed to push ahead with the deployment of a new missile defense system, known by the acronym Thaad, that is designed to intercept North Korea’ medium-range missiles.

_____

•n Myanmar, crucial information has emerged in the apparent assassination of U Ko Ni, a Muslim human rights lawyer, on Sunday: He had been working to strip the military of its extraordinary political powers.

“his bullet was not only for Ko Ni,” colleague said, suggesting the attack was meant against the rulin"
"H_077.txt","Justice Kagan","y will have matters pending before that court. It is quite common for Supreme Court lawyers to express views on nominees without explicitly mentioning their pending cases, as it goes without saying that a Supreme Court practitioner practices before the court. When many Supreme Court lawyers (including former solicitors general) wrote op-eds and publicly praised Judge Garland during his nomination, their pending cases were not mentioned either. The same thing happened with the chief justice’ and","’ confirmations; The New York Times is in good company. Moreover, it would be completely speculative to presume what a nominee might do as a justice in any particular case. That is especially true in light of my diverse caseload at the Court, which includes a variety of pending matters that might appeal to different judicial ideologies, or that have no clear ideological angle at all. All of that is presumably why your editors did not include such information in my article.

The problem is that t"
"H_077.txt","Judge Neil Gorsuch","Standing guard at the Supreme Court building after President Trump introduced","as his nominee. | Gabriella Demczuk for The New York Times

Document NYTFEED020170202ed2200911"
"H_077.txt","How Much Disclosure About","*","an Op-Ed Author Is Required?

Standing guard at the Supreme Court building after President Trump introduced Judge Neil Gorsuch as his nominee. | Gabriella Demczuk for The New York Times

Document NYTFEED020170202ed2200911"
"H_077.txt","Atlantic Highlands","Here’ one email from Mithra Busler of",", N.J."
"H_077.txt","Neal Katyal","The opinion piece by",", “hy Liberals Should Back Neil Gorsuch,”ails to disclose the many conflicts of interest that plague Mr. Katyal’ credibility as an evenhanded commentator. He is allowed to wave his position as acting solicitor general in the Obama administration as liberal bona fides but fails to mention that his current work involves representing large corporate interests in front of the Supreme Court. At least two of these cases would almost certainly benefit from the confirmation of the pro-corporation Gorsuc"
"H_077.txt","Gabriella Demczuk","Standing guard at the Supreme Court building after President Trump introduced Judge Neil Gorsuch as his nominee. |","for The New York Times"
"H_077.txt","Judge Today","Arguing for a",", and Before Him Tomorrow

By LIZ SPAYD

Neal K."
"H_077.txt","President Donald Trump","He is no conservative, and says he is disappointed that the latest nominee to the court is from the White House of","."
"H_077.txt","Supreme Court","He also thought it was obvious to The Times that as a lawyer whose practice often brings him to the",", he would have a case before it."
"H_077.txt","Judge Garland","It is a matter of public record that I am a Supreme Court lawyer and naturally will have matters pending before that court. It is quite common for Supreme Court lawyers to express views on nominees without explicitly mentioning their pending cases, as it goes without saying that a Supreme Court practitioner practices before the court. When many Supreme Court lawyers (including former solicitors general) wrote op-eds and publicly praised","during his nomination, their pending cases were not mentioned either."
"H_078.txt","Congress","Anybody who did not know better might come away thinking there is room to doubt whether humans are the main cause of global warming. Mr. Pruitt did not actually say that, of course —owadays, hard-core climate denial provokes a furious response from Democrats in","and mild protest even from a few Republicans."
"H_078.txt","Drew Shindell","“f all the natural drivers, and everything we know that works on long time scales that has ever affected climate in the past, all those things have been ruled out,”aid",", an atmospheric scientist at <pos>Duke University</pos>. “eyond a reasonable doubt, it has to be human activities.”

The most important uncertainties are not really about the cause of global warming —e are the cause —ut in trying to forecast how big the coming changes will be.

If emissions continue at a high level but the Earth turns out to be less sensitive to greenhouse gases than currently believed, that would give humanity a few extra decades to come to grips with the situation. But it is"
"H_078.txt","Bill Gates","Many people —","among them —ee this as the most urgent issue. Renewable energy and greater use of natural gas are helping lower emissions in the short run, but if we do not invest heavily in research and development now, we may not have the technology we will eventually need to get to zero emissions.

People like Mr. Gates and the entrepreneur Elon Musk are working on Mr. Trump. If the president’ mind is really open on global warming, as he said after the election, perhaps he could also sit down with a few of"
"H_078.txt","Britain","“hey’e just trying not to look crazy, because if they look too crazy, then Susan Collins”— Republican senator from Maine —“nd a few of the moderate Republicans might jump ship,”aid Raymond T. Pierrehumbert, an American climate scientist who holds a chair at <pos>Oxford University</pos>, in","."
"H_078.txt","Rick Perry","But the most interesting statements came from",", Mr."
"H_078.txt","Democrats","Anybody who did not know better might come away thinking there is room to doubt whether humans are the main cause of global warming. Mr. Pruitt did not actually say that, of course —owadays, hard-core climate denial provokes a furious response from","in Congress and mild protest even from a few Republicans."
"H_078.txt","Republican Language Cools Off","","as the Planet Heats Up

By JUSTIN GILLIS"
"H_078.txt","Planet Heats Up","Republican Language Cools Off as the","By JUSTIN GILLIS"
"H_078.txt","President Trump","Several variations on the new approach were on display recently during confirmation hearings for some of","’ cabinet nominees.

“cience tells us that the climate is changing and human activity in some manner impacts that change,”cott Pruitt, the Oklahoma attorney general nominated to run the Environmental Protection Agency, told a Senate committee. “he human ability to measure with precision the extent of that impact is subject to continuing debate and dialogue, as well they should be.”

Let us ponder the craftsmanship of that second sentence.

“ith precision”s the key phrase, of course, and it rende"
"H_078.txt","Maine","“hey’e just trying not to look crazy, because if they look too crazy, then Susan Collins”— Republican senator from","—“nd a few of the moderate Republicans might jump ship,”aid Raymond T. Pierrehumbert, an American climate scientist who holds a chair at <pos>Oxford University</pos>, in Britain.

In interviews, Dr. Pierrehumbert and several other experts said the public should not be fooled. The deep consensus among climate scientists, arrived at through decades of research, is that human activity is the cause of most of the planetary warming of recent decades, and probably all of it.

What is the evidence?

F"
"H_079.txt","United States","Trump released a memo saying the","could force Mexico to pay by blocking remittances, the nearly $25 billion sent home by Mexicans every year, money earned from hard labor that supports the poorest communities south of the border. It has also been suggested he will try to tax those transfers. Either action would be challenged in the courts, especially as most of that money has already been taxed, and migrants would look for alternative ways to move it. But he might succeed in getting some of his funds this way.

A note in the ex"
"H_079.txt","Behind Mr","","."
"H_079.txt","President Trump","","claims Mexico should pay because it has an annual trade surplus of $60 billion with the United States.

The U.S. has a 60 billion dollar trade deficit with Mexico. It has been a one-sided deal from the beginning of NAFTA with massive numbers... —Donald J. Trump (@realDonaldTrump)

of jobs and companies lost. If Mexico is unwilling to pay for the badly needed wall, then it would be better to cancel the upcoming meeting. —Donald J. Trump (@realDonaldTrump)

This is utter madness. By the same logi"
"H_079.txt","Mexican Shakedown","Trump’","By IOAN GRILLO"
"H_079.txt","Washington","It was the issue that forced President into a corner, so he had no choice but to cancel his meeting in","."
"H_079.txt","Mexico","The idea he floated of a 20 percent tax on goods coming from","fell like a ton of bricks when it was pointed out that American consumers would be the ones paying."
"H_079.txt","President Trump","But perhaps this idea of humiliating Mexico is what really appeals to","and his most fervent supporters."
"H_079.txt","Now Mexico","","finds itself facing the biggest shakedown of all from north of the Rio Grande, as the United States president demands $12 billion to $15 billion to pay for a border wall.

This is not meant to be a jokey comparison. President Trump’ insistence that he will force Mexico to pay is the definition of extortion: obtaining un-owed money through coercion. It is a dark moment in American foreign policy that has implications far beyond the southern border; it tells the world the United States no longer"
"H_079.txt","American","It is a dark moment in","foreign policy that has implications far beyond the southern border; it tells the world the United States no longer believes in fair play or the rule of law."
"H_079.txt","Eugenia Vald","As Marí","é, a political scientist at Mexico’ <pos>Autonomous Metropolitan University</pos>, said to me: “e wants to make an example of Mexico to show how he will deal with countries around the world.”

Shakedowns are cemented through violence. Behind Mr. Trump’ rhetoric, many Mexicans sense the implicit threat of American force, backed by a history of occupations and wars. “here is a real risk of the conflict turning into violence,”s. Valdé said. “his man is capable of anything.”

I hope such fears are c"
"H_080.txt","President Trump","Understand this:","is not America!

I apologize to , the brave young Yazidi woman from Iraq who was made a sex slave —ut since escaping, has campaigned around the world against ISIS and sexual slavery. She has been nominated for a Nobel Peace Prize, yet is now barred from the United States.

I apologize to , a heroic Somali woman who has battled for decades for women’ health and led the fight against . Edna speaks at American universities, champions girls’ducation and defies extremists —nd she’ one of those inspi"
"H_080.txt","President Trump","An Apology to Muslims for","By NICHOLAS KRISTOF

Whenever an extremist in the Muslim world does something crazy, people demand that moderate Muslims step forward to condemn the extremism."
"H_080.txt","If Somalis","","can stand up to extremists, we can, too."
"H_080.txt","Somalia","Yet Dr. Abdi’ camp, serving 90,000 people, was just about the only thing working properly in",", and Somalis at home and around the world united to denounce the militants and speak up for her."
"H_080.txt","Barack Obama","Bush and","both oversaw improvements in vetting."
"H_080.txt","Yet Dr","","."
"H_080.txt","An Apology","","to Muslims for President Trump

By NICHOLAS KRISTOF

Whenever an extremist in the Muslim world does something crazy, people demand that moderate Muslims step forward to condemn the extremism."
"H_080.txt","United States","She has been nominated for a Nobel Peace Prize, yet is now barred from the","."
"H_080.txt","Yet Trump","","tackled the issue in a way that bolsters the ISIS narrative and thus makes us less safe."
"H_080.txt","America","In effect, Trump took a real problem, inflated it with hysteria, handled it with incompetence and created an unjust policy that targets seven mostly impoverished Muslim countries that haven’ produced a single person involved in a lethal terrorist attack in","since before 9/11. Islamophobia swirls through the order, and Rudy Giuliani has helpfully that Trump asked him to devise a way to create a Muslim ban and “o it legally.”

There’ a certain symmetry here.

I’e sat down in mosques in Pakistan, Afghanistan and Yemen and heard jihadists justify intolerance. Those men (always men!) “therize”nfidels as fundamentally different, as threats who must be confronted; Trump “therizes”uslims in a similar way.

Trump’ national security adviser, , has referred"
"H_081.txt","New Orleans","Here the po’oys are made with loaves from Leidenheimer Baking Company in",", which have crusts as thin as the skin of a balloon, ready to fracture."
"H_081.txt","New Orleans","The restaurant is in Boerum Hill, Brooklyn, but its red sign was painted by hand on Magazine Street in","."
"H_081.txt","Open Daily","","for lunch and dinner."
"H_081.txt","Leidenheimer Baking","Here the po’oys are made with loaves from","Company in New Orleans, which have crusts as thin as the skin of a balloon, ready to fracture."
"H_081.txt","James Booker","Inside, a golden football helmet with a fleur-de-lis overlooks portraits of Napoleon, hand thrust inside waistcoat, and the blues pianist",", called the Bayou Maharajah, in eye patch and halo."
"H_081.txt","Atlantic Avenue","224","(Court Street), Boerum Hill; 917-909-1471; thegumbobros.com

Recommended Cajun chicken and sausage gumbo; roast beef po’oy; rice and debris gravy; braised greens; fried green tomatoes with réoulade; mini bourbon pecan pie; beignets.

Drinks and Wine Chicory coffee and Abita root beer. The restaurant will serve Louisiana-made beer when the liquor license is confirmed.

Prices $4 to $14; all major cards.

Open Daily for lunch and dinner.

Reservations Not accepted.

Wheelchair Access The entrance"
"H_081.txt","New York","Mr. Lathan grew up on the Gulf Coast of Alabama, in Creole country; his business partner, Clay Boulware, comes from Cajun central Louisiana. Once roommates at <pos>Louisiana State University</pos>, they reunited in","a few years ago to redress the city’ scarcity of gumbo, selling the dish at outdoor food markets before opening the restaurant in early December.

Some say gumbo is less learned than inherited. Mr. Lathan got his starter recipe from his great-grandmother Nanny, who passed it down to his father. It begins with a roux of canola oil and flour cooked just short of total darkness and fused with onion, celery and bell pepper.

His Cajun gumbo speaks in smoke, leached from andouille sausage made by a"
"H_081.txt","Reservations Not","","accepted."
"H_081.txt","Court Street","224 Atlantic Avenue (","), Boerum Hill; 917-909-1471; thegumbobros.com

Recommended Cajun chicken and sausage gumbo; roast beef po’oy; rice and debris gravy; braised greens; fried green tomatoes with réoulade; mini bourbon pecan pie; beignets.

Drinks and Wine Chicory coffee and Abita root beer. The restaurant will serve Louisiana-made beer when the liquor license is confirmed.

Prices $4 to $14; all major cards.

Open Daily for lunch and dinner.

Reservations Not accepted.

Wheelchair Access The entrance is up a short"
"H_081.txt","Boerum Hill","224 Atlantic Avenue (Court Street),","; 917-909-1471; thegumbobros.com

Recommended Cajun chicken and sausage gumbo; roast beef po’oy; rice and debris gravy; braised greens; fried green tomatoes with réoulade; mini bourbon pecan pie; beignets.

Drinks and Wine Chicory coffee and Abita root beer. The restaurant will serve Louisiana-made beer when the liquor license is confirmed.

Prices $4 to $14; all major cards.

Open Daily for lunch and dinner.

Reservations Not accepted.

Wheelchair Access The entrance is up a short ramp from the"
"H_082.txt","On Twitter","",", the <pos>Berkeley</pos> campus police described the episode on Wednesday night as “ajor protest attacks”nd urged people to stay away. Crowds lingered despite police orders to disperse.

In a statement, campus administrators condemned the violence and said it “ill now overshadow the efforts to engage in legitimate and lawful protest against the performer’ presence and perspectives.”

The university had gone to “extraordinary lengths”o plan for the event, it said, putting dozens of additional of"
"H_082.txt","and speaking to other","The university had gone to “extraordinary lengths”o plan for the event, it said, putting dozens of additional officers on duty","campuses where Mr."
"H_082.txt","he belittled a transgender","More than 100 faculty members called for blocking the event in a letter to Chancellor Nicholas Dirks. It cited a speech Mr. Yiannopoulos delivered at the <pos>University of Wisconsin-Milwaukee</pos> where","student by name."
"H_082.txt","someone maybe on your","“ don’ even know if they know what they’e protesting,”he said. “s it the free speech? Having","campus who has a dissenting point of view or wants to present an alternative point of view?”

Gavin Newsom, the lieutenant governor of California and a former mayor of San Francisco, tweeted that he was “ppalled”t Mr. Trump’ apparent threat to take away the university’ federal funding.

As a UC Regent I'm appalled at your willingness to deprive over 38,000 students access to an education because of the actions of a few. pic.twitter.com/zzUaaaUM3u —Gavin Newsom (@GavinNewsom) February 2, 2017

M"
"H_082.txt","Getty Images","Police officers carried away a protester during a demonstration on the <pos>U.C. Berkeley</pos> campus on Wednesday. | Elijah Nouvelage/","| A protest in Berkeley, Calif., on Wednesday, aimed at Milo Yiannopoulos. | Elijah Nouvelage/Getty Images | A bonfire on Sproul Plaza at <pos>U.C. Berkeley</pos>, on Wednesday during a rally against a speaking appearance Milo Yiannopoulos. | Ben Margot/Associated Press

Document NYTFEED020170202ed22001rx"
"H_082.txt","Associated Press","Police officers carried away a protester during a demonstration on the <pos>U.C. Berkeley</pos> campus on Wednesday. | Elijah Nouvelage/Getty Images | A protest in Berkeley, Calif., on Wednesday, aimed at Milo Yiannopoulos. | Elijah Nouvelage/Getty Images | A bonfire on Sproul Plaza at <pos>U.C. Berkeley</pos>, on Wednesday during a rally against a speaking appearance Milo Yiannopoulos. | Ben Margot/",""
"H_082.txt","After Berkeley","",", he had no future appearances scheduled, according to his website."
"H_082.txt","Milo Yiannopoulos",", on Wednesday, aimed at",". | Elijah Nouvelage/Getty Images | A bonfire on Sproul Plaza at <pos>U.C. Berkeley</pos>, on Wednesday during a rally against a speaking appearance Milo Yiannopoulos. | Ben Margot/Associated Press

Document NYTFEED020170202ed22001rx"
"H_082.txt","Donald Trump Tweets Outrage","Berkeley Cancels Milo Yiannopoulos Speech, and","By CHRISTOPHER MELE"
"H_082.txt","President Trump","Early Thursday morning,","spoke out against the university for canceling the event."
"H_083.txt","An American","","commando was killed, and several civilians may also have died, the Pentagon said.

• vow to overturn law banning political activity by churches.

Mr. Trump said he would “otally destroy” the Johnson Amendment, which prohibits churches from openly endorsing or campaigning for candidates.

Those that do risk losing their tax-exempt status. Repealing the law would require approval by Congress

•rump’ education pick may be in peril.

Two Republican senators said they would join Democrats in voting"
"H_083.txt","Supreme Court","Gorsuch, his choice for the",".

•sraeli settlement plans kick into high gear.

Israel has approved thousands more housing units in the occupied West Bank and, for the first time in years, has called for the establishment of a new settlement there.

On Wednesday, settlers living in an unauthorized outpost clashed with the police, who had been sent to evacuate about 40 families.

•iolence breaks out on a campus..

A speech by the divisive Breitbart News editor Milo Yiannopoulos at the <pos>University of California, Berkeley</"
"H_083.txt","Vice President Mike Pence","Clair, with","and President Trump after Mr."
"H_083.txt","Breitbart News","A speech by the divisive","editor Milo Yiannopoulos at the <pos>University of California, Berkeley</pos>, was canceled Wednesday night after demonstrators set fires and threw objects.

•elaware prison standoff ends.

A corrections worker taken hostage by inmates was found dead this morning, a day after the standoff began. A second worker was found alive after the state police stormed a building at the James T. Vaughn Correctional Facility.

•ntroducing The Daily, your new audio news report.

Our reporter Michael Barbaro"
"H_083.txt","Michael Barbaro","Our reporter","runs down the big stories and the big ideas."
"H_083.txt","On Wednesday","",", settlers living in an unauthorized outpost clashed with the police, who had been sent to evacuate about 40 families.

•iolence breaks out on a campus..

A speech by the divisive Breitbart News editor Milo Yiannopoulos at the <pos>University of California, Berkeley</pos>, was canceled Wednesday night after demonstrators set fires and threw objects.

•elaware prison standoff ends.

A corrections worker taken hostage by inmates was found dead this morning, a day after the standoff began. A second"
"H_083.txt","Betsy De","Donald Trump, Australia,","Vos: Your Thursday Briefing

By SEAN ALFANO"
