"T_39.txt","Jonathan Zimmerman","Analog learning works better. Writing notes by hand is better than typing them on a laptop, according to a 2014 Princeton study. People taking notes by hand use fewer words but they have better recall of concepts. “People who take notes on computers are transcribing, and people taking notes by hand tend to be choosing more,” said",", a professor at the <pos>University of Pennsylvania</pos>’s <pos>Graduate School of Education</pos>. “An important part of learning is ordering things, and you do that more with note taking.”

Web surfing is the new secondhand smoke. Dr. Zimmerman, like me, used to spot students looking at entertainment websites in class, a disengagement he thought hurt the student and the class over all. Even sitting next to someone multitasking on a laptop could affect your learning and performance, according"
"T_39.txt","he thought hurt the","Zimmerman, like me, used to spot students looking at entertainment websites in class, a disengagement","student and the class over all."
"T_39.txt","to teach at the","I used","graduate school of information sciences at the <pos>University of California, Berkeley</pos>. I couldn’t believe how many students looked at ESPN.com or its ilk in class. We live in a world of screens, where digital distractions contend with our need to learn. Is multitasking a good idea?

No. Clifford Nass, a <pos>Stanford</pos> professor who pioneered research into how humans interact with technology, conducted numerous studies of people juggling different cognitive tasks, like talking on the"
"T_39.txt","Hyun Song","Joo-",", a psychologist working with the neuroscientist Patrick Bédard at <pos>Brown University</pos>, found that when people learn motor skills with a distraction, the two are internalized. That can create better learning, particularly if you have to recall facts in a dissonant environment. “When pilots are learning how to handle emergency situations,” Dr. Song said, “it’s better if they learn them with distractions going on.”

But don’t turn the volume to 11. “If you can take an exam while you have T"
"T_39.txt","t believe how many","I used to teach at the graduate school of information sciences at the <pos>University of California, Berkeley</pos>. I couldn’","students looked at ESPN.com or its ilk in class. We live in a world of screens, where digital distractions contend with our need to learn. Is multitasking a good idea?

No. Clifford Nass, a <pos>Stanford</pos> professor who pioneered research into how humans interact with technology, conducted numerous studies of people juggling different cognitive tasks, like talking on the phone, watching television and working on a computer. Basically, people are bad at it. They are actually moving in and ou"
"T_39.txt","Deal With Digital Distractions","How to",""
"T_39.txt","used to spot","Zimmerman, like me,","students looking at entertainment websites in class, a disengagement he thought hurt the student and the class over all."
"T_4.txt","President Trump","Representative Tom Price of Georgia,","'s choice for secretary of Health and Human Services, has been assailed by Democrats in recent weeks over his investment in health care companies at the same time that he pushed legislation that could have benefited those businesses."
"T_4.txt","Innate Immunotherapeutics","What about Representative Collins and his ties to","?

Mr. Collins's involvement with a small, speculative company is indeed odd, some of the experts said.

Innate is a tiny biotechnology company that is traded on the Australian stock exchange and has no approved drugs. The company has run out of money more than once and nearly closed its doors.

But Mr. Collins has remained one of its biggest boosters. He has been an investor in the company since 2005.

Several of Mr. Collins's friends and associates are also investors, including two of his adul"
"T_4.txt","Sheldon Whitehouse","Price, including","of Rhode Island, also trade in health care stocks.

'"
"T_4.txt","Zimmer Biomet","Price bought stock in",", a company that makes orthopedic implants, shortly before he introduced legislation that could have protected the company from financial losses because of new federal regulation."
"T_4.txt","Representative Tom Price","''","of Georgia during his confirmation hearing on Tuesday in Washington"
"T_4.txt","Health Secretary Under Scrutiny","Trump's Pick for","for Investments

Representative Tom Price of Georgia, President Trump's choice for secretary of Health and Human Services, has been assailed by Democrats in recent weeks over his investment in health care companies at the same time that he pushed legislation that could have benefited those businesses."
"T_4.txt","While Mr","","."
"T_4.txt","Rhode Island","Price, including Sheldon Whitehouse of",", also trade in health care stocks.

'"
"T_4.txt","Representative Chris Collins","Price has said he learned of the company from",", Republican of New York, and Mr."
"T_4.txt","But Mr","","."
"T_40.txt","Harvard Square","That’s why I have been on strike with 750 co-workers for more than two weeks. That’s why the other day, co-workers and I were arrested after we sat down in",", blocking traffic, in an act of civil disobedience."
"T_40.txt","never been in a","Cambridge, Mass. — I’ve been at <pos>Harvard University</pos> for 17 years, but I’ve","classroom here."
"T_40.txt","Harvard","But for most of my time at","it’s been hard.

The average dining hall worker makes $31,193 a year, higher than other cafeterias in the area, but it still doesn’t go far around Boston. That’s why we’re asking for an annual salary of $35,000 for some financial stability, particularly since most dining halls are open only during the school year. Right now I’m lucky to work in one of the few cafeterias that’s open all year.

I know that health care costs are going up everywhere, and I don’t have all the answers. But there must"
"T_40.txt","Harvard","If good health is truly “one of the fundamental rights of every human being,” then shouldn’t that also apply to the human beings working in","’s cafeterias"
"T_40.txt","Harvard Square","That’s why I have been on strike with 750 co-workers for more than two weeks. That’s why the other day, co-workers and I were arrested after we sat down in",", blocking traffic, in an act of civil disobedience."
"T_40.txt","day I serve amazing","Cambridge, Mass. — I’ve been at <pos>Harvard University</pos> for 17 years, but I’ve never been in a classroom here. I’m a cook in the dining halls. I work in the cafeteria at the <pos>T.H. Chan School of Public Health</pos>, where every","students studying medicine, nutrition and child welfare, as well as the doctors and researchers who train them."
"T_40.txt","why the medical school","That’s why I have been on strike with 750 co-workers for more than two weeks. That’s why the other day, co-workers and I were arrested after we sat down in Harvard Square, blocking traffic, in an act of civil disobedience. And that’s","students, in their white coats, have been walking the picket line with us in solidarity."
"T_40.txt","Richest University","Struggling to Serve at the Nation’s",""
"T_41.txt","The Journal","Irwin Braverman of the Yale School of Medicine, who, with his Yale museum partner Linda Friedlaender, published the positive results of a controlled study in","of the American Medical Association in 2001."
"T_41.txt","Modern Art","Pitman brought together 130 educators and doctors involved in 60 programs to share their teaching strategies and evaluation methods at a conference she organized in June at the Museum of","in New York."
"T_41.txt","June","Pitman brought together 130 educators and doctors involved in 60 programs to share their teaching strategies and evaluation methods at a conference she organized in","at the Museum of Modern Art in New York."
"T_41.txt","Dallas Museum","Frequent hospitalizations took such a toll on her that she had to step down from her dream job as director of the","of Art, and she uses a breathing apparatus to open her airways several times a day."
"T_41.txt","Bhavika Kaul","",", who took an observation course as a student and now jointly teaches it at the <pos>Baylor College of Medicine in Houston</pos>, credited art observation with helping her catch a patient’s misdiagnosis during her residency. “When I walked in the room, the first thing I noticed was the patient, who had been in the hospital without sun exposure, was 10 shades darker than her family members,” she said. “I immediately diagnosed her with adrenal insufficiency.”

“The course had taught me to see beyo"
"T_41.txt","Eye Can Help","How an Aesthete’s","a Doctor’s Hand

For eight years, Bonnie Pitman has been battling a rare, incurable lung infection. Frequent hospitalizations took such a toll on her that she had to step down from her dream job as director of the Dallas Museum of Art, and she uses a breathing apparatus to open her airways several times a day.

Some might find her condition utterly discouraging. But in days filled with medical care, Ms. Pitman has found uplift from art, leading her to redirect her more than 40 years of experien"
"T_41.txt","Mo","Addressing the gathering at","MA on the first morning, Ms."
"T_41.txt","Dallas Museum","For the last two years, Ms. Pitman has taught an observation course in partnership with a doctor at the <pos>University of Texas Southwestern Medical School</pos> and with educators at the","of Art, where she resigned as director in 2011."
"T_41.txt","American Medical Association","Irwin Braverman of the Yale School of Medicine, who, with his Yale museum partner Linda Friedlaender, published the positive results of a controlled study in The Journal of the","in 2001."
"T_41.txt","New York","Pitman brought together 130 educators and doctors involved in 60 programs to share their teaching strategies and evaluation methods at a conference she organized in June at the Museum of Modern Art in","."
"T_42.txt","Reaches Tentative Agreement","<pos>Harvard</pos>","to End Cafeteria Workers’ Strike

Cafeteria workers at Harvard, who have been on strike for nearly three weeks in an effort to avoid an increase in their health care costs and to earn higher salaries, could return to work this week after a tentative agreement was reached with the university, a union president said.

Brian Lang, the president of Unite Here Local 26, which represents about 750 cafeteria workers, confirmed that terms had been reached early Tuesday morning that satisfied the worker"
"T_42.txt","End Cafeteria Workers","<pos>Harvard</pos> Reaches Tentative Agreement to","’ Strike

Cafeteria workers at Harvard, who have been on strike for nearly three weeks in an effort to avoid an increase in their health care costs and to earn higher salaries, could return to work this week after a tentative agreement was reached with the university, a union president said.

Brian Lang, the president of Unite Here Local 26, which represents about 750 cafeteria workers, confirmed that terms had been reached early Tuesday morning that satisfied the workers’ demands.

Mediators he"
"T_42.txt","On Tuesday","",", it would be reviewed and voted on by the full bargaining committee."
"T_42.txt","by a coalition of","Mr. Lang said that if the union voted to accept the deal, the strike would end and the employees would return to work Thursday. He said that 95 percent of the union’s members had participated through the duration of the strike and that they had been joined","students, faculty and alumni.

“This started out as a group of the lowest-paid workers on the richest university deciding to take a stand for themselves and their families,” he said. “In this battle, the side that was fighting for a more humane approach won out.”

In a testament to the workers’ determination, some who were not aware that a deal had been struck braved a chilly October morning to keep the strike going. Karyn Regal, a reporter for WBZ News Radio in Boston, reported that some had r"
"T_42.txt","Boston","Karyn Regal, a reporter for WBZ News Radio in",", reported that some had returned to protest with their picket signs at about 7:45 a.m. Tuesday"
"T_42.txt","Brian Lang","",", the president of Unite Here Local 26, which represents about 750 cafeteria workers, confirmed that terms had been reached early Tuesday morning that satisfied the workers’ demands.

Mediators helped work out the agreement between a union subcommittee and the university. On Tuesday, it would be reviewed and voted on by the full bargaining committee. It would then be brought before the entire union membership on Wednesday, and those on strike could return to work as soon as Thursday.

Mr. Lang s"
"T_42.txt","Katie Lapp","Tania deLuzuriaga, a spokeswoman for the university, confirmed that there was a tentative agreement with the union. She later forwarded a statement from <pos>Harvard</pos>’s executive vice president,",", which confirmed that Tuesday’s deal had addressed the issues of health care and wages.

Mr. Lang said that if the union voted to accept the deal, the strike would end and the employees would return to work Thursday. He said that 95 percent of the union’s members had participated through the duration of the strike and that they had been joined by a coalition of students, faculty and alumni.

“This started out as a group of the lowest-paid workers on the richest university deciding to take a sta"
"T_42.txt","Harvard","Cafeteria workers at",", who have been on strike for nearly three weeks in an effort to avoid an increase in their health care costs and to earn higher salaries, could return to work this week after a tentative agreement was reached with the university, a union president said."
"T_42.txt","Unite Here Local","Brian Lang, the president of","26, which represents about 750 cafeteria workers, confirmed that terms had been reached early Tuesday morning that satisfied the workers’ demands.

Mediators helped work out the agreement between a union subcommittee and the university. On Tuesday, it would be reviewed and voted on by the full bargaining committee. It would then be brought before the entire union membership on Wednesday, and those on strike could return to work as soon as Thursday.

Mr. Lang said he was confident the committee"
"T_42.txt","News Radio","Karyn Regal, a reporter for WBZ","in Boston, reported that some had returned to protest with their picket signs at about 7:45 a.m. Tuesday"
"T_43.txt","Abu Khaled","Then the portraits disappear, replaced by doors, which open. In walk the two combatants —",", a fighter for the Popular Front for the Liberation of Palestine, and Gilad Peled, an Israeli soldier — seeming, except for a little pixelation and rigid body movement, like flesh-and-blood people who are actually in the room with me.

Their presence, in a deeply affecting experiment in communication, called “The Enemy,” underway at <pos>M.I.T.</pos>, is the result of a collaboration between Mr. Ben Khelifa and Fox Harrell, an associate professor of digital media. It holds the promise of openin"
"T_43.txt","Tel Aviv","Peled in",", asking them the same six questions — basic ones like “Who’s your enemy and why?”; “What is peace for you?”; “Have you ever killed one of your enemies?”; “Where do you see yourself in 20 years?”

Then he and a small crew captured three-dimensional scans of the men and photographed them from multiple angles. (He later repeated this process in the Democratic Republic of Congo. He is expanding the project to El Salvador, which is being decimated by gang violence.)"
"T_43.txt","Karim Ben Khelifa","On the walls at either end are striking poster-size black-and-white portraits taken by the noted Belgian-Tunisian photographer",", one showing a young Israeli soldier and another a Palestinian fighter about the same age, whose face is almost completely hidden by a black hood."
"T_43.txt","Popular Front","Then the portraits disappear, replaced by doors, which open. In walk the two combatants — Abu Khaled, a fighter for the","for the Liberation of Palestine, and Gilad Peled, an Israeli soldier — seeming, except for a little pixelation and rigid body movement, like flesh-and-blood people who are actually in the room with me.

Their presence, in a deeply affecting experiment in communication, called “The Enemy,” underway at <pos>M.I.T.</pos>, is the result of a collaboration between Mr. Ben Khelifa and Fox Harrell, an associate professor of digital media. It holds the promise of opening up new frontiers for the integr"
"T_43.txt","The Enemy","Their presence, in a deeply affecting experiment in communication, called “",",” underway at <pos>M.I.T.</pos>, is the result of a collaboration between Mr. Ben Khelifa and Fox Harrell, an associate professor of digital media. It holds the promise of opening up new frontiers for the integration of journalism and art in a socially oriented 21st-century performance piece poised at technology’s cutting edge.

The work grows out of more than half a century of collaborations between the world of art and the worlds of science and technology, spurred by pioneers like Experiments"
"T_43.txt","Tel Aviv","Peled in",", asking them the same six questions — basic ones like “Who’s your enemy and why?”; “What is peace for you?”; “Have you ever killed one of your enemies?”; “Where do you see yourself in 20 years?”

Then he and a small crew captured three-dimensional scans of the men and photographed them from multiple angles. (He later repeated this process in the Democratic Republic of Congo. He is expanding the project to El Salvador, which is being decimated by gang violence.)"
"T_43.txt","Belgium","In an interview before I experienced the virtual reality environment, Mr. Ben Khelifa, 44, said the idea emerged from a frustration that deepened over almost 20 years he spent as a photojournalist covering strife — often entrenched, interminable warfare — mostly in the Middle East. “Being a Tunisian growing up in",", I think I always felt like I was wearing two different kinds of shoes,” he said. “In Iraq and Afghanistan, I could sometimes see things about fighters on both sides of the conflict that some other Europeans couldn’t.”

What he saw there was a culture of warfare that often perpetuated itself through misunderstanding and misinformation, with no mechanism for those of opposing sects or political forces to gain a sense of the enemy as a fellow human being. “I began to think, ‘I’m meeting the same"
"T_43.txt","In Iraq","In an interview before I experienced the virtual reality environment, Mr. Ben Khelifa, 44, said the idea emerged from a frustration that deepened over almost 20 years he spent as a photojournalist covering strife — often entrenched, interminable warfare — mostly in the Middle East. “Being a Tunisian growing up in Belgium, I think I always felt like I was wearing two different kinds of shoes,” he said. “","and Afghanistan, I could sometimes see things about fighters on both sides of the conflict that some other Europeans couldn’t.”

What he saw there was a culture of warfare that often perpetuated itself through misunderstanding and misinformation, with no mechanism for those of opposing sects or political forces to gain a sense of the enemy as a fellow human being. “I began to think, ‘I’m meeting the same people over and over again,’” he said. “I’m seeing people I knew as kids, and now they’re g"
"T_43.txt","Fox Harrell","Ben Khelifa and",", an associate professor of digital media."
"T_43.txt","Fred Waldhauer","The work grows out of more than half a century of collaborations between the world of art and the worlds of science and technology, spurred by pioneers like Experiments in Art and Technology, begun in 1967 by the Bell Labs engineers Billy Klüver and","and the artists Robert Rauschenberg and Robert Whitman."
"T_44.txt","Los Angeles Unified School District","Brokers and insurance executives say it has become more difficult to walk into schools freely in recent years — the",", for instance, strictly forbids soliciting on campus."
"T_44.txt","Connecticut","Bradley Bergeron’s first professional job out of college was selling retirement savings investments to public schoolteachers in","."
"T_44.txt","Dan Otter","“Teachers are still being preyed upon by salespeople,” said",", founder of the advocacy and educational site 403bwise.com, and a longtime teacher now working at the <pos>University of New Mexico</pos>. “The problem is their first experience with a 403(b) is in a sales environment.”

At Axa — which has about $16.3 billion in 403(b) assets held for employees of elementary, middle or high schools — sales representatives often start the conversation with prospective clients using a so-called yellow pad presentation, several former brokers said, even if they do"
"T_44.txt","Bradley Bergeron","","’s first professional job out of college was selling retirement savings investments to public schoolteachers in Connecticut. The applications he carried in his black leather briefcase, however, were for one type of product only: a high-priced variable annuity.

“From the teacher’s standpoint, they really miss out getting quality advice,” said Mr. Bergeron, 27, who sold the plans for Axa Advisors’ retirement benefits group. “People who are in the schools pitching them and positioning themselves a"
"T_44.txt","Morningstar","63 percent, according to an analysis from","."
"T_44.txt","Axa Advisors","Bergeron, 27, who sold the plans for","’ retirement benefits group. “People who are in the schools pitching them and positioning themselves as retirement specialists are really there just to sell them one product.”

Workers at private companies typically enroll in a 401(k) retirement plan approved by the employer, which is held responsible for the menu of investment options offered. But public school employees and people working for nonprofits and religious institutions are often exposed to brokers who operate in a more unruly market"
"T_44.txt","An Annuity","","for the Teacher — and the Broker

Bradley Bergeron’s first professional job out of college was selling retirement savings investments to public schoolteachers in Connecticut. The applications he carried in his black leather briefcase, however, were for one type of product only: a high-priced variable annuity.

“From the teacher’s standpoint, they really miss out getting quality advice,” said Mr. Bergeron, 27, who sold the plans for Axa Advisors’ retirement benefits group. “People who are in the"
"T_44.txt","strictly forbids soliciting on","Brokers and insurance executives say it has become more difficult to walk into schools freely in recent years — the Los Angeles Unified School District, for instance,","campus."
"T_44.txt","For Axa","","’s brokers, that role is usually assigned to Axa’s Equi-Vest variable deferred annuity. It isn’t simple: To get the full rundown on how it works, people must sift through a document that is 460 pages long.

And it doesn’t come cheap. The most popular version of the Equi-Vest annuity has a total annual cost that can range from 1.81 to 2.63 percent, according to an analysis from Morningstar.

In contrast, large 401(k) plans usually charge an annual fee of less than half a percent of assets, accord"
"T_44.txt","At Axa","","— which has about $16.3 billion in 403(b) assets held for employees of elementary, middle or high schools — sales representatives often start the conversation with prospective clients using a so-called yellow pad presentation, several former brokers said, even if they don’t always have it written down on the yellow pads all teachers are familiar with.

Brokers are trained to start by explaining how a teacher’s state pension works, how the tax-advantaged 403(b) operates and what sort of gap migh"
"T_45.txt","April","The cases set off a torrent of online criticism as well as a protest on campus in","."
"T_45.txt","Provo","The 34-page report, researched and drafted by a four-person advisory council starting in May, came after news accounts that the Mormon-run university in",", Utah, had investigated students for possible honor code violations after they reported being sexually assaulted."
"T_45.txt","Face Honor Code Sanctions","<pos>Brigham Young</pos> Students Who Report Sexual Assault Won’t",""
"T_45.txt","Students Who Report Sexual Assault Won","<pos>Brigham Young</pos>","’t Face Honor Code Sanctions

<pos>Brigham Young University</pos> announced on Wednesday that it would spare students who report sexual assaults from facing punishment for violations of its honor code, such as drinking or extramarital sex, that may have happened near or at the time of the assault.

The university called the handling of sexual assault reporting “a complicated and evolving issue” and said in a report released on Wednesday that offering amnesty from potential sanctions would help e"
"T_45.txt","Professor Valentine","As for whether the amnesty might encourage false reports of sexual assault to cover for possible code violations,","said the group had few concerns about that possibility."
"T_45.txt","Utah","She said the overriding mission was to do whatever possible to encourage victims to report, adding that a 2008 study in","found that only 12 percent of victims come forward"
