"S_060.txt","Morehead State","She had researched flagships in Michigan, Alabama and Kentucky, but her parents were concerned about safety, so she applied to",", a 40-minute drive from her home, in Wallingford (pop. 2,300). “ake U.K., it is in a big city,”he said. “here are shootings. I would rather be safe and close.”mily is the fourth of five children, and the first to apply to college. In a county where only 13 percent of adults hold a bachelor’ degree, the credential isn’ much valued. “ am hoping with our new president that people will realize it is not a necessity,”aid Emily’ mother, bringing up her eldest son, who makes “ lot of money”unning a to"
"S_060.txt","Rose Hill High School","At Wallace-","in North Carolina, course offerings are limited, and his only live class is English literature and composition, also A.P."
"S_060.txt","Richard Livingston","For five hours of his school day,","is parked in a computer lab, his MacBook perched on a folding table, taking online Advanced Placement in biology, human geography and United States government and politics."
"S_060.txt","Amanda Wahlstedt","A teenager who liked to engage her high school classmates on touchy issues like race and women’ rights,","wrote an opinion piece for The Courier-Journal in Louisville on how college is out of poor students’each. Impressed, a college consultant offered help, gratis. Amanda is now a freshman at <pos>Wellesley College</pos>, where she has outfitted her dorm room in comforting Kentucky memorabilia. The adjustment is tough in ways she didn’ expect. In Barbourville (pop. 3,100) “ was the token liberal,”he said. (So her father couldn’ hear, she would watch “he Daily Show”n mute, though it was hard to pick"
"S_061.txt","El Paso","On a late-autumn Sunday, a bus pulled out of El Paso at 3 a.m. carrying 52 sleepy students and parents from western Texas and New Mexico. A few had already driven several hours to get to El Paso. The bus arrived at <pos>Texas A&M</pos> 12 hours later, in time for a walking tour and dinner. After “ggieland”nformation sessions, including a student panel and classroom visits, a stop at the and an all-night drive, they arrived back in","at 8 a.m. Tuesday.

“eople don’ realize that Texas is a huge state,”aid Scott McDonald, director of admissions at <pos>Texas A&M</pos> who came up with the idea of bus trips upon realizing that students from remote areas would not visit on their own. “Sometimes colleges say, ‘e don’ get many of those students; it’ not worth our time.’ ”e disagrees. Rural students bring “ unique perspective”o campus, he said. “n terms of diversity, geography is just as important as racial and ethnic.”

Mr. McDon"
"S_061.txt","carrying 52 sleepy","","students and parents from western Texas and New Mexico."
"S_061.txt","half of her 25","Jeanne Minton, dean of students at Union City High School in Oklahoma, said that only","seniors are considering higher education. “n the small area where we are from, there are not always a lot of high expectations,”he said. “e are not striving to be valedictorian or have a C average or higher. We are striving to get graduated.

“nce they get out of high school, getting them to college is hard,”he said. Although she brings students to a college fair at a nearby community college, she said that “he last one we attended was worthless —y students walked around and they were ready to"
"S_061.txt","Related Articles","","Just 29 percent of 18- to 24-year-olds in rural areas are enrolled in college."
"S_061.txt","financial aid to 30,000","In September, with the ability to identify such students from its database, the College Board sent customized guides on applying to college and for","students in rural schools. “etter reaching rural students has been a top priority since I joined four years ago,”aid David Coleman, president and chief executive of the College Board.

A team is also in place exploring more tailored help, including virtual college advisers with local knowledge, a rural-specific college application guide, outreach to counselors in rural districts and more online help (100,000 rural students have signed up for personalized SAT practice on the Khan Academy site th"
"S_061.txt","Pomona","Sapp, the admissions director at",", was assigned to rural North Carolina."
"S_061.txt","College Advising Corps","Over the last few years, College Possible,","and College Forward have expanded their free counseling into remote areas."
"S_061.txt","While Portland State","","is not one of the country’ land-grant universities, with an agriculture mission and major, it attracts its share of Oregon’ rural students “ho want something radically different,”aid Shannon Carr, director of admissions. With big agriculture buying up smaller farms, “verything is becoming more automated and competitive,”he said. “here is a sense that the more business acumen a family member can bring to the table, the better.”till, there remain “roud families that have learned by doing”ithout c"
"S_061.txt","Academic Excellence","The belief that college is for other people, not country folk, is hard to break, said Sahar Mohammadzadeh, a high school junior and a leader of the Student Voice Team of the for",", a Kentucky education advocacy group."
"S_061.txt","David Coleman","In September, with the ability to identify such students from its database, the College Board sent customized guides on applying to college and for financial aid to 30,000 students in rural schools. “etter reaching rural students has been a top priority since I joined four years ago,”aid",", president and chief executive of the College Board."
"S_062.txt","Soviet Union","'' He recalled the Tsarnaev brothers, who were from a Muslim-majority part of the former",", entered the United States on tourist visas and then applied for asylum.

'"
"S_062.txt","President Trump","CORRECTION APPENDEDSal Oliva, a hotel worker and Uber courier from Staten Island, is ecstatic about","'s executive order."
"S_062.txt","Minnesota","11, but had a new surge of worry after the knife attack by a Somali-American last year in a mall in",", where her son and his family live."
"S_062.txt","Lower Manhattan","Bower, it evokes his stepsister, whose husband works in","and was there on Sept. 11. He was on one of the last trains out of the city that morning and, even now, Mr. Bower said, she is scared every day her husband goes to work.

''I guess I would probably say I adopted my sister's view,'' he said. ''I see how it affects her. I don't think it's bad to re-examine what we are doing.''

Mr. Bower, a college-educated Republican, said he voted for Mr. Trump largely to avoid voting for Hillary Clinton. He said he is watching what the president does and would"
"S_062.txt","Promise Kept","Flip Side of Outrage: Some See a","By SABRINA TAVERNISE; Caitlin Dickerson contributed reporting."
"S_062.txt","Manhattan","''These people in",", they don't know what's going on in the outer boroughs,'' he said. '"
"S_062.txt","Manhattan","Trump's face tattooed on his arm -- said people in","did not understand his love for Mr."
"S_062.txt","January","For all the outrage the order has stirred, including among some Republicans, two recent polls found that a plurality of Americans support some type of suspension of immigration. A <pos>Quinnipiac University</pos> poll in","found that, by a ratio of 48 to 42 percent, voters supported ''suspending immigration from 'terror prone' regions, even if it means turning away refugees from those regions.'"
"S_062.txt","Caitlin Dickerson","By SABRINA TAVERNISE;","contributed reporting."
"S_062.txt","Since Sept","",". 11, 2001, no one has been killed in a terrorist attack in the United States by an immigrant -- or the son or daughter of an immigrant -- from any of the seven countries in the 90-day visa ban. A vast majority of killings over all happen at the hands of native-born Americans. Some recent attacks in which the Islamic State was invoked were carried out by Muslims born in the United States.

But emotions are powerful forces, and much of what people know comes from smartphone and tablet screens sho"
"S_063.txt","Industrial Revolution","After settling down to teach at <pos>Bennington College</pos>, Polanyi published his major work, which looked at how the","was so disruptive that it created the conditions for both Communism and fascism."
"S_063.txt","United States","Reasons for leaving: Hitler’ takeover of parts of Czechoslovakia forced her family, supporters of the early Czech democrat Edvard Benes, to go into exile and finally emigrate to the","in 1948."
"S_063.txt","Loung Ung","",", “irst They Killed My Father” (2001)

Country of origin: Cambodia

Reasons for leaving: Escaped from Pol Pot’ Khmer Rouge regime in 1979, ending up in Vermont.

Ung’ memoir of life near the edge of the “illing fields”s a harrowing attempt at a collective document. “f you had been living in Cambodia during this period, this would be your story too,”he writes. Her father was killed, and she was starved and near death by the time she managed to enter a Vietnamese refugee camp. It’ a story that is"
"S_063.txt","Cuba","Garcia’ first novel looked at three generations of women exiled from",", all with complex feelings about the country, from love and nostalgia to revulsion."
"S_063.txt","New York","For the daughter of a revolutionary, now living in",", her memories are of being raped by one of Castro’ young followers. “he wants no part of Cuba,”arcia writes of this young woman, “o part of its wretched carnival floats creaking with lies, no part of Cuba at all.”

Henry Kissinger, “iplomacy” (1994)

Country of origin: Germany

Reasons for leaving: A German Jew, he fled with his family in 1938.

The former secretary of state tried to sum up in this book his realist foreign policy approach, taking a historical tour from Europe in the 17th centur"
"S_063.txt","German Jew","Reasons for leaving: In 1933, Arendt, a",", left her country and eventually settled in Paris, where she helped Jewish refugees."
"S_063.txt","Sierra Leone","Country of origin:","Reasons for leaving: Forced to become a child soldier at the age of 12, Beah eventually escaped Freetown in 1997 with the help of Unicef and ended up in New York City."
"S_063.txt","Masha Gessen","",", “he Man Without a Face” (2012)

Country of origin: Soviet Union

Reasons for leaving: Gessen’ family was Jewish and denied religious freedom in the Soviet Union (or the right to freely emigrate). In 1981 her family was granted permission to leave.

Gessen, a child of the Soviet Union, offers up a portrait of Vladimir Putin as a man formed by his many years in the K.G.B. She finds the roots of his illiberalism, his secrecy, his disregard for democratic norms. It’ an authoritarianism she fears o"
"S_063.txt","United States","Reason for leaving: After surviving World War II in Poland and initially joining the postwar Communist government, Milosz defected in 1951, eventually emigrating to the","in 1960."
"S_063.txt","West Indian","Brodsky was interested in the poet’ role in society, and these essays, which deal with politics, literature and his own personal experience of exile, all get at this question. For him, poetry was “he most democratic art,”s he says in an essay about the","poet Derek Walcott."
"S_064.txt","Breitbart News","•n appearance by Milo Yiannopoulos, an editor at",", will go on as planned on Wednesday at Berkeley despite protests. [San Francisco Chronicle]

•undreds of people have flocked to Seacliff State Beach to see a World War I-era tanker that was destroyed by strong weather this month. [Los Angeles Times]

•The Getty Research Institute in Los Angeles has acquired the archives of Joanie 4 Jackie, the artist Miranda July’ feminist video series. [The New York Times T Magazine]

•eet San Francisco’ first K-9 corps, which began policing the city’ streets"
"S_064.txt","The New York Times","•esla is giving the California power grid a boost. [","]

•he Los Angeles police have solved the 1976 murder of Karen Klaas, the ex-wife of the Righteous Brothers singer Bill Medley. [ABC News]

•fter years of options that ranged from bad to very bad, sports arenas, including Levi’ stadium in Santa Clara, are trying to offer better culinary options. [New York Times]

•n appearance by Milo Yiannopoulos, an editor at Breitbart News, will go on as planned on Wednesday at Berkeley despite protests. [San Francisco Chronicle]

•undreds of people have floc"
"S_064.txt","Bill Medley","•he Los Angeles police have solved the 1976 murder of Karen Klaas, the ex-wife of the Righteous Brothers singer",". [ABC News]

•fter years of options that ranged from bad to very bad, sports arenas, including Levi’ stadium in Santa Clara, are trying to offer better culinary options. [New York Times]

•n appearance by Milo Yiannopoulos, an editor at Breitbart News, will go on as planned on Wednesday at Berkeley despite protests. [San Francisco Chronicle]

•undreds of people have flocked to Seacliff State Beach to see a World War I-era tanker that was destroyed by strong weather this month. [Los Angeles Time"
"S_064.txt","Measure H rally here","He used his stage at a well-attended","to urge voters not to support the development measure, which he described as economically crippling. “ote no on Measure S!”e said.

The good news, depending on how you look at it, is that this is the last time Los Angeles will have one of these afterthought spring election. Voters here approved a measure in 2015 to move all elections to November.

California Online

(Please note: We regularly highlight articles on news sites that have limited access for nonsubscribers.)

• resolution in the Cal"
"S_064.txt","Los Angeles","This vote follows a separate sales tax measure overwhelmingly approved by","city voters just last November, for $1.2 billion in housing for homeless people.

“eople are taxing themselves to pay for something that they consider a problem, but that may not immediately advance their own interests,”aid Raphael J. Sonenshein, the executive of the <pos>Pat Brown Institute for Public Affairs</pos> at <pos>California State University-Los Angeles</pos>. “eople just feel it’ the right thing to do. It’ astonishing.”

The other high-profile measure is Measure S, imposing a two-yea"
"S_064.txt","World War","•undreds of people have flocked to Seacliff State Beach to see a","I-era tanker that was destroyed by strong weather this month. [Los Angeles Times]

•The Getty Research Institute in Los Angeles has acquired the archives of Joanie 4 Jackie, the artist Miranda July’ feminist video series. [The New York Times T Magazine]

•eet San Francisco’ first K-9 corps, which began policing the city’ streets in 1962. [San Francisco Chronicle]

And Finally ...

We’e racing through the awards season, that annual Hollywood tradition that puts actors and other artists through a"
"S_064.txt","Santa Clara","•fter years of options that ranged from bad to very bad, sports arenas, including Levi’ stadium in",", are trying to offer better culinary options. [New York Times]

•n appearance by Milo Yiannopoulos, an editor at Breitbart News, will go on as planned on Wednesday at Berkeley despite protests. [San Francisco Chronicle]

•undreds of people have flocked to Seacliff State Beach to see a World War I-era tanker that was destroyed by strong weather this month. [Los Angeles Times]

•The Getty Research Institute in Los Angeles has acquired the archives of Joanie 4 Jackie, the artist Miranda July’ femi"
"S_064.txt","Screen Actors Guild Awards","We’e racing through the awards season, that annual Hollywood tradition that puts actors and other artists through a seemingly endless parade of red carpets and acceptance speeches. (And oh, what speeches we’e had this year.) Last week began with the nominations for the Academy Awards, and it ended with the",", whose winners often predict the Oscars."
"S_064.txt","California Today","","is edited by Julie Bloom, who grew up in Los Angeles and attended U.C. Berkeley."
"S_064.txt","Levi","Eric Garcetti, center, the mayor of Los Angeles, speaking on Monday in support of Measure H, which would institute a quarter-cent sales tax in Los Angeles County to pay for services for the homeless. | Andrew Cullen for The New York Times | Tesla battery packs at Southern California Edison’ Mira Loma substation. | Tesla | The rooftop farm at","’ Stadium in Santa Clara, Calif., which serves the restaurants inside. | Levi's Stadium | Miranda July in Portland, Ore., in 1995, the year she began her feminist video series Joanie 4 Jackie (then called Big Miss Moviola). | Heide Foley | Alex Hibbert in “oonlight.”mong its many Oscars nominations, it is competing for best picture. | David Bornfriend/A24"
"S_065.txt","Olympic Games","The French capital is eager to host the","in 2024 and the World Expo in 2025."
"S_065.txt","Sadiq Khan","• half-century after the family of",", the mayor of London, immigrated to Britain, their adopted neighborhood Tooting scarcely resembles the blue collar area of Mr."
"S_065.txt","The Boy Scouts","•","of America paved the way for transgender scouts, saying they would begin accepting members based on the gender listed on their application. [The New York Times]

Smarter Living

•f you’e never tried yoga, why not now? Here’ what you need to know to get started.

•n a related story, we’e found a really cheap way to get happier: Get up and move around.

•ecipe of the day: Try this spinach salad with pancetta and fried eggs.

Noteworthy

• half-century after the family of Sadiq Khan, the mayor of"
"S_065.txt","Chancellor Angela Merkel","Trump, like","of Germany, or possibly facing protests at home, like Prime Minister Theresa May of Britain.

_____

•resident Trump appeared to try to shift the public’ attention elsewhere, saying in a Twitter post that he would announce his pick for the vacant Supreme Court seat on Tuesday.

Weighing the implications of a Trump-appointed justice, our legal reporter says abortion rights and affirmative action appear secure for now, but unions and environmentalists have cause for concern.

_____

Messages of s"
"S_065.txt","Your Morning Briefing","_____","is published weekday mornings."
"S_065.txt","The French","","capital is eager to host the Olympic Games in 2024 and the World Expo in 2025."
"S_065.txt","Donald Trump","",", Quebec, Joseph Goebbels: Your Tuesday Briefing

By PATRICK BOEHLER"
"S_065.txt","The New York Times","•The Boy Scouts of America paved the way for transgender scouts, saying they would begin accepting members based on the gender listed on their application. [","]

Smarter Living

•f you’e never tried yoga, why not now? Here’ what you need to know to get started.

•n a related story, we’e found a really cheap way to get happier: Get up and move around.

•ecipe of the day: Try this spinach salad with pancetta and fried eggs.

Noteworthy

• half-century after the family of Sadiq Khan, the mayor of London, immigrated to Britain, their adopted neighborhood Tooting scarcely resembles the blue collar area of Mr. Khan’ boyhood. The melting pot has gentrified."
"S_065.txt","World Expo","The French capital is eager to host the Olympic Games in 2024 and the","in 2025."
"S_065.txt","The Times","When the tower was inaugurated at a world exhibition in 1889,","wrote: “h! who will deliver us from the Eiffel Tower!”

And in 1937, The Times described the tower as “n aesthetic misfit”hat would soon be razed. “t is felt that the Eiffel Tower is out of date and out of perspective. So it is doomed.”

We were, of course, wrong.

_____

Your Morning Briefing is published weekday mornings.

What would you like to see here? Contact us at europebriefing@nytimes.com."
"S_066.txt","Calvin Brent","","was Washington’ first African-American architect. The civil rights activist Mary Church Terrell graduated from Oberlin College in 1884; her father was recognized as the first black millionaire in the South, and her husband was the first black municipal court judge in Washington. We also meet the United States senator Blanche Bruce of Mississippi, who later served appointments under four presidents.

But the reader shouldn’ expect a happy ending in “he Original Black Elite.”he rug of opportunity"
"S_066.txt","Baltimore","As Taylor traces Murray’ pre-Civil War childhood in","and his subsequent move to Washington, it becomes clear that his success —etting hired and promoted for his government job, purchasing real estate and building a reputation in the business community —as due to timing, connections and his ability to network with both whites and blacks. His older half brother, Samuel Proctor, was not only a successful Washington caterer whose client list included President Abraham Lincoln, but also the proprietor of one of the two restaurants in the Capitol. Beca"
"S_066.txt","Washington","The civil rights activist Mary Church Terrell graduated from Oberlin College in 1884; her father was recognized as the first black millionaire in the South, and her husband was the first black municipal court judge in","."
"S_066.txt","Woodrow Wilson","After taking office in March 1913,","oversaw the segregation of federal offices, demoting and firing black employees; the few who were allowed to stay were suddenly required to use “olored only”athrooms and eating areas.

Murray’ life spanned the beginning and the end of an era. While he enjoyed many years of integrated experiences in Washington, just 12 years after Wilson’ inauguration and 74 years after he was born, Taylor writes, “aniel Murray died in a segregated hospital and was buried in a segregated graveyard.”

Lawrence Ot"
"S_066.txt","Phillips Academy","Greener was a successful attorney after attending","and then <pos>Harvard University</pos>; he became Harvard’ first black graduate in 1870. James Wormley owned the Wormley Hotel, a luxury establishment that opened in 1871 and catered to affluent white visitors. (In a bitter irony, it was also the reported site of the Hayes-Tilden Compromise of 1877, which marked the end of Reconstruction.) The newspaper publisher Pinckney Pinchback served as lieutenant governor and acting governor of Louisiana, and owned a mansion near the Chinese Embassy. Calv"
"S_066.txt","Civil War","As Taylor traces Murray’ pre-","childhood in Baltimore and his subsequent move to Washington, it becomes clear that his success —etting hired and promoted for his government job, purchasing real estate and building a reputation in the business community —as due to timing, connections and his ability to network with both whites and blacks. His older half brother, Samuel Proctor, was not only a successful Washington caterer whose client list included President Abraham Lincoln, but also the proprietor of one of the two restauran"
"S_066.txt","White House","in car. The 40-some passengers —ll white, except for Murray —ade up a special welcoming committee appointed by President William McKinley, on the occasion of honoring Admiral George Dewey for his victory in Manila Bay. Despite an initial picture that suggests Murray embraced cliché of racial tranquillity, Taylor makes clear throughout her book that Murray and most of his black elite friends “id not crave the company of white people.”aylor, an independent scholar and the author of “ Slave in the",": Paul Jennings and the Madisons,”nderstands the mind-set of the black elite, and she quickly points out that despite his own rise to the top, “aniel Murray was ‘ race man to the core’ ”

“f he took any pride in being the first black man to join this organization or the only one to be invited to that social occasion, his greater goal, his long-range vision, was to be in the vanguard of merit-based recognition for every American of color. The rise of those in Murray’ black elite circle was realiz"
"S_066.txt","Muslim American","It was evident when the country took the land and the lives of a once-thriving Native American population, and again when the government endorsed the internment of innocent Japanese-American families during World War II; it can be seen again today, as a new president uses rhetoric that demonizes","citizens."
"S_066.txt","Civil War","By tracing the ascent of Daniel Murray, the wealthy black civic leader, businessman and assistant librarian at the Library of Congress, Taylor reveals how black Americans after the","benefited from opportunities afforded by Reconstruction policies."
"S_066.txt","Forgotten Era","Daniel Murray and the Story of a","By Elizabeth Dowling Taylor"
"S_067.txt","Stanley","In each of the variations, however, a fateful event at","’ business (a burglary, a fire, a tragic death or a buyout) leads to altered circumstances. As a result, the Fergusons of Chapter 2 are more easily distinguishable. In one version, the family has taken a step down the economic ladder; in another, it’ solidly middle class; in yet another, it’ rich. In the most striking variation, Rose and Archie move to Manhattan, immersing themselves in a more sophisticated urban world of art galleries, classical music, foreign films and private schools.

A diff"
"S_067.txt","By Paul Auster","By TOM PERROTTA",""
